<?xml version="1.0" encoding="UTF-8"?>
<!DOCTYPE rackmap SYSTEM "/usr/share/slurm-web/restapi/schema/dtd/racks.dtd">
<rackmap>

  <!--
    This file is an example of XML rackmap file for slurm-web.

    You must adapt it (or write one from scratch) to fit the racks composition
    of your own HPC cluster.

    First define your node types with their model name and dimensions. Then,
    define your racks with their positions and their nodes. You do not need to
    specify the position of all nodes. Specify the positions of the nodes in
    the 1st row + the position of the first node in the 2nd row. Then, the
    backend program is able to compute the positions of all other nodes (in
    nodesets) based on these initial positions.
  -->

  <nodetypes>
    <nodetype id="m32x4321"
              model="Vendor A 32 x4321"
              height="1"
              width="0.5"
              />
    <nodetype id="b43"
              model="Vendor B 43"
              height="2"
              width="1"
              />
  </nodetypes>


  <racks posx="0" posy="0" width="500" depth="300" rackwidth="1">
    <racksrow posx="0">
      <!-- Rack A1 -->
      <rack id="A1" posy="0">
        <nodes>
          <nodeset id="cn[001-036]"
                   type="m32x4321"
                   posx="0"
                   posy="3" />

          <nodeset id="cn[037-072]"
                   type="m32x4321"
                   posx="0"
                   posy="23" />
        </nodes>
      </rack>

      <!-- Rack A2 -->
      <rack id="A2" posy="1">
        <nodes>
          <nodeset id="cn[500-506],cn900"
                   type="m32x4321"
                   posx="0"
                   posy="42"
                   draw="down" />
          <node id="cn800"
                type="m32x4321"
                posx="0"
                posy="1" />
          <node id="cn801"
                type="b43"
                posx="0"
                posy="3" />
        </nodes>
      </rack>

      <!-- Rack A3 -->
      <rack id="A3" posy="2">
        <nodes>
          <nodeset id="cn[505-518]"
                   type="m32x4321"
                   posx="0"
                   posy="2" />

          <nodeset id="cn[519-536]"
                   type="m32x4321"
                   posx="0"
                   posy="10" />

          <nodeset id="cn[537-572]"
                   type="m32x4321"
                   posx="0"
                   posy="23" />
        </nodes>
      </rack>
    </racksrow>
  </racks>

</rackmap>
